{
  "version": 1,
  "title": "诊断边界 · 几何实播回归",
  "canvas": {
    "width": 1600,
    "height": 900,
    "fps": 30
  },
  "theme": {
    "font": "Noto Sans CJK SC",
    "latin_font": "Space Grotesk SemiBold",
    "background": "F4F2EA",
    "foreground": "173330"
  },
  "slides": [
    {
      "id": "boundary-0",
      "duration": 6000,
      "objects": [
        {
          "id": "heading-0",
          "kind": "text",
          "text": "分别记录可测运动与检测边界。",
          "box": [
            108,
            160,
            1380,
            110
          ],
          "size": 58,
          "fill": "173330",
          "font": "Noto Serif CJK SC"
        },
        {
          "id": "purpose-0",
          "kind": "text",
          "text": "圆形旋转无方向线索；文本 Morph 与角度不由当前轮廓算法认证。",
          "box": [
            112,
            300,
            1380,
            60
          ],
          "size": 28,
          "fill": "173330"
        },
        {
          "id": "footer-0",
          "kind": "text",
          "text": "仓库自制几何回归；不代表真实业务数据。",
          "box": [
            108,
            844,
            1380,
            36
          ],
          "size": 21,
          "fill": "173330"
        },
        {
          "id": "shared-text",
          "kind": "text",
          "text": "文本主体：需要独立追踪",
          "box": [
            110,
            400,
            950,
            65
          ],
          "size": 38,
          "fill": "173330"
        },
        {
          "id": "measurable",
          "kind": "rect",
          "box": [
            140,
            580,
            150,
            130
          ],
          "fill": "00766A",
          "animations": [
            {
              "kind": "move",
              "at": 350,
              "duration": 1800,
              "path": [
                [
                  0,
                  0
                ],
                [
                  3.865993248815555,
                  0
                ],
                [
                  7,
                  -3.134006751184445
                ],
                [
                  7,
                  -7
                ],
                [
                  7,
                  -10.865993248815554
                ],
                [
                  3.865993248815555,
                  -14
                ],
                [
                  0,
                  -14
                ],
                [
                  -3.865993248815555,
                  -14
                ],
                [
                  -7,
                  -10.865993248815554
                ],
                [
                  -7,
                  -7
                ],
                [
                  -7,
                  -3.134006751184445
                ],
                [
                  -3.865993248815555,
                  0
                ],
                [
                  0,
                  0
                ]
              ],
              "accel": 0.25,
              "decel": 0.25,
              "ambient": true
            }
          ]
        },
        {
          "id": "rotating",
          "kind": "ellipse",
          "box": [
            760,
            540,
            160,
            160
          ],
          "fill": "7751A8",
          "animations": [
            {
              "kind": "rotate",
              "at": 600,
              "duration": 1800,
              "degrees": 35
            }
          ]
        }
      ],
      "background": "F4F2EA",
      "transition": {
        "kind": "fade",
        "duration": 350
      }
    },
    {
      "id": "boundary-1",
      "duration": 6000,
      "objects": [
        {
          "id": "heading-1",
          "kind": "text",
          "text": "未支持的对象，保留待检。",
          "box": [
            108,
            160,
            1380,
            110
          ],
          "size": 58,
          "fill": "173330",
          "font": "Noto Serif CJK SC"
        },
        {
          "id": "purpose-1",
          "kind": "text",
          "text": "圆形旋转无方向线索；文本 Morph 与角度不由当前轮廓算法认证。",
          "box": [
            112,
            300,
            1380,
            60
          ],
          "size": 28,
          "fill": "173330"
        },
        {
          "id": "footer-1",
          "kind": "text",
          "text": "仓库自制几何回归；不代表真实业务数据。",
          "box": [
            108,
            844,
            1380,
            36
          ],
          "size": 21,
          "fill": "173330"
        },
        {
          "id": "shared-text",
          "kind": "text",
          "text": "文本主体：需要独立追踪",
          "box": [
            610,
            370,
            950,
            65
          ],
          "size": 38,
          "fill": "173330"
        },
        {
          "id": "measurable",
          "kind": "rect",
          "box": [
            1190,
            560,
            230,
            170
          ],
          "fill": "00766A",
          "animations": [
            {
              "kind": "move",
              "at": 350,
              "duration": 1800,
              "path": [
                [
                  0,
                  0
                ],
                [
                  3.865993248815555,
                  0
                ],
                [
                  7,
                  -3.134006751184445
                ],
                [
                  7,
                  -7
                ],
                [
                  7,
                  -10.865993248815554
                ],
                [
                  3.865993248815555,
                  -14
                ],
                [
                  0,
                  -14
                ],
                [
                  -3.865993248815555,
                  -14
                ],
                [
                  -7,
                  -10.865993248815554
                ],
                [
                  -7,
                  -7
                ],
                [
                  -7,
                  -3.134006751184445
                ],
                [
                  -3.865993248815555,
                  0
                ],
                [
                  0,
                  0
                ]
              ],
              "accel": 0.25,
              "decel": 0.25,
              "ambient": true
            }
          ]
        }
      ],
      "background": "F4F2EA",
      "transition": {
        "kind": "morph",
        "duration": 1800
      }
    }
  ]
}
